{
  "schema_version": "1.0.0",
  "search_space_id": "search-space:generated-example-family",
  "created_at": "2026-08-31T08:00:00Z",
  "updated_at": "2026-08-31T09:20:00Z",
  "scope_description": "Four candidates emitted by generation:example-001 and screened as one predeclared family.",
  "candidate_universe_refs": [
    "generation:example-001"
  ],
  "candidates_registered": 4,
  "planned_screen_count": 4,
  "screens_performed": 2,
  "screens_passed": 1,
  "family_alpha": 0.05,
  "effective_threshold_percentile": 98.75,
  "adjustment_method": "BONFERRONI",
  "method_parameters": {
    "justification": "All four generated candidates are eligible for the same entry screen; the family size was fixed before the first result.",
    "effective_test_count": null,
    "bh_rank": null,
    "p_values_ref": null,
    "method_evidence_ref": null
  },
  "correlation_note": "Bonferroni remains valid under dependence and is used here without claiming the four tests are independent."
}
